title,year,genre,poster_link,summary,imdb_rating,letterboxd_rating,my_rating,language,streaming_source,my_tag
My Client's Wife,2023,Thriller,https://www.themoviedb.org/search?query=My+Client's+Wife,A lawyer becomes entangled with his client's wife in a dangerous web of secrets and desire.,5.7,2.4,3.5,Hindi,ZEE5,weird watch
Seance,2021,Horror/Thriller,https://www.themoviedb.org/search?query=Seance,"At a prestigious boarding school, a new student participates in a seance and finds her classmates dying one by one, seemingly tied to a ghost story.",5.5,2.4,2.6,English,Need to download and watch,weird watch
The Perfect Nanny,2019,Thriller,https://www.themoviedb.org/search?query=The+Perfect+Nanny,A nanny and her employer develop a disturbing relationship that descends into obsession and danger.,5.8,2.6,2.5,English,Netflix,weird watch
The Gift,2015,Thriller/Drama,https://www.themoviedb.org/search?query=The+Gift,"A couple settles into their new home and renews an acquaintance with an old classmate who leaves unsettling gifts, as dark past secrets come to light.",7.7,3.8,3.5,English,Prime Video,mind bending shit
Oddity,2024,Horror/Thriller,https://www.themoviedb.org/search?query=Oddity,A blind psychic medium investigates the murder of her twin sister with the help of a cursed life-size wooden mannequin.,6.7,3.6,3.0,English,Shudder / Need to download and watch,weird watch
Red Rooms,2023,Crime/Thriller,https://www.themoviedb.org/search?query=Red+Rooms,A model becomes obsessed with the high-profile trial of a serial killer accused of murdering teenage girls and selling footage on the dark web.,7.1,3.9,3.5,French,Mubi,mind bending shit
Schindler's List,1993,Drama/History,https://www.themoviedb.org/search?query=Schindler's+List,"In German-occupied Poland, industrialist Oskar Schindler gradually becomes concerned for his Jewish workforce after witnessing the horrors of the Holocaust.",9.0,4.6,5.0,English/German/Hebrew,Prime Video,"masterpiece, you are in for a crying session"
BA Pass,2012,Drama/Thriller,https://www.themoviedb.org/search?query=BA+Pass,A young man from a poor background is seduced by an older woman and drawn into a dangerous lifestyle of crime in Delhi.,7.5,3.5,3.0,Hindi,Need to download and watch,weird watch
Marty Supreme,2025,Drama/Sport,https://www.themoviedb.org/search?query=Marty+Supreme,"In 1952 New York, a young table tennis prodigy goes to extreme lengths to prove himself the best in the world, sacrificing everyone around him in the process.",7.9,3.8,4.5,English,Apple TV+,you are in for a crying session
I Saw the Devil,2010,Thriller/Horror,https://www.themoviedb.org/search?query=I+Saw+the+Devil,A special agent blurs the line between good and evil in his obsessive revenge mission against the serial killer who murdered his fiancee.,7.8,4.0,4.0,Korean,Need to download and watch,"mind bending shit, weird watch"
Lady Vengeance,2005,Crime/Thriller,https://www.themoviedb.org/search?query=Lady+Vengeance,"After 13 years in prison for a murder she didn't commit, a beautiful woman seeks revenge on the man who framed her, in Park Chan-wook's Vengeance Trilogy.",7.6,4.0,4.0,Korean,Mubi,mind bending shit
Sarvam Maya,2025,Drama,https://www.themoviedb.org/search?query=Sarvam+Maya,"A spiritual drama exploring illusion, truth, and the nature of reality.",5.5,2.5,3.0,Tamil,Need to download and watch,mind bending shit
Sentimental Value,2025,Drama,https://www.themoviedb.org/search?query=Sentimental+Value,"Two estranged sisters reunite with their filmmaker father, whose plan to cast one of them in his comeback film stirs unresolved family wounds in Joachim Trier's Cannes hit.",7.9,4.1,4.3,Norwegian,Netflix,you are in for a crying session
Hamnet,2025,Drama/History,https://www.themoviedb.org/search?query=Hamnet,An adaptation of Maggie O'Farrell's novel imagining the life of Shakespeare's son Hamnet and the grief that may have inspired the playwright's greatest work.,7.1,3.5,4.0,English,Apple TV+,you are in for a crying session
Audition,1999,Horror/Thriller,https://www.themoviedb.org/search?query=Audition,"A lonely widower holds fake film auditions to find a new wife, becoming fixated on a mysterious young woman whose dark secrets are far more horrifying than he could imagine.",7.2,3.9,4.0,Japanese,Mubi,"mind bending shit, weird watch"
La Grazia,2025,Drama,https://www.themoviedb.org/search?query=La+Grazia,"A meditative drama exploring grace, forgiveness, and human connection in a rural Italian setting.",5.8,2.9,3.5,Italian,Need to download and watch,weird watch
Kontinental'25,2025,Drama,https://www.themoviedb.org/search?query=Kontinental'25,A contemporary drama set in Russia exploring generational conflict and political identity.,6.2,2.8,3.0,Hungarian,Need to download and watch,mind bending shit
The Good Sister,2025,Thriller/Drama,https://www.themoviedb.org/search?query=The+Good+Sister,A woman discovers unsettling truths about her seemingly perfect sister in this psychological thriller.,5.9,2.6,3.5,French,Netflix,weird watch
Shadowbox,2025,Documentary,https://www.themoviedb.org/search?query=Shadowbox,"An intimate documentary exploring trauma, creativity, and the human spirit.",7.5,3.7,3.5,Bengali,Need to download and watch,weird watch
Blue Heron,2025,Drama,https://www.themoviedb.org/search?query=Blue+Heron,"A quiet drama about nature, solitude, and the search for peace.",5.8,2.7,4.0,English,Need to download and watch,you are in for a crying session
Old Woman with a Knife,2022,Action/Thriller,https://www.themoviedb.org/search?query=Old+Woman+with+a+Knife,A 70-year-old contract killer must reconcile her violent profession with her past in this dark Korean action drama.,6.8,3.3,3.5,Korean,Netflix,weird watch
A Pregnant Widow,2025,Drama,https://www.themoviedb.org/search?query=A+Pregnant+Widow,A Malayalam drama exploring the struggles of a pregnant widow navigating social expectations and personal grief.,5.5,2.4,5.0,Malayalam,Need to download and watch,you are in for a crying session
No Other Choice,2025,Drama/Thriller,https://www.themoviedb.org/search?query=No+Other+Choice,A tense drama about impossible choices and moral compromise.,5.8,2.5,5.0,Korean,Need to download and watch,you are in for a crying session
We Believe You,2025,Drama,https://www.themoviedb.org/search?query=We+Believe+You,A drama about survivors of trauma and the long journey towards being heard and believed.,5.9,2.6,4.0,French,Need to download and watch,you are in for a crying session
